"event_code", "event_name"
108568, "2024淡江大學行政單位數位轉型暨淨零轉型成果觀摩展"
108567, "淡江大學理學院物理學系教師評審委員會113學年度第1次會議"
108566, "工學院新型專班討論會議"
108565, "112年度生活實驗室成果討論會(優化淡江大學周邊行人交通：從學生和居民的角度出發)"
108564, "西班牙語文學系112學年度第2學期強化多元實務課程 - 業師演講「 影視翻譯實務座談會」"
108563, "2024淨零轉型聯盟高峰會"
108562, "接種COVID-19疫苗 保護自己守護全家人"
108561, "衛生保健宣導活動-骨密檢測活動4月23日"
108560, "衛生保健宣導活動-骨密檢測活動4月22日"
108559, "112學年度第2學期第2次行政主管會報"
108558, "淡江大學113學年度商管學院企業管理學系教師評審委員會第1次會議紀錄陳閱單"
108557, "112學年度淡江大學教師跨領域研究社群-「人工智慧大語言模型應用」研究社群"
108551, "淡江大學體育事務處募款委員會112學年度第4次會議"
108550, "淡江大學工學院暨AI創智學院112學年度第2學期第1次獎學金會議"
108549, "淡江大學國際化策略推動委員會112學年度第4次會議"
108548, "淡江大學體育事務處教師評審委員會113學年度第2次會議會議紀錄"
108547, "淡江大學體育事務處教師評審委員會113學年度第2次會議"
108546, "淡江大學機械與機電工程學系113學年度第2次教師評審委員會（會簽單）"
108545, "淡江大學機械與機電工程學系113學年度第2次教師評審委員會（簽到單）"
108544, "淡江大學112學年度第2學期學生事務會議"
108543, "淡江大學師資培育中心教師評審委員會113學年度第2次會議-會簽"
108542, "淡江大學師資培育中心教師評審委員會113學年度第2次會議-報到"
108541, "淡江大學師資培育中心教師評審委員會113學年度第1次會議-會簽"
108540, "淡江大學師資培育中心教師評審委員會113學年度第1次會議-報到"
108539, "資訊處網路管理組113年03月TQM小組會議"
108538, "淡江大學圖書館採編組112學年度第5次TQM小組會議"
108537, "淡江大學永續發展與社會創新中心112學年度第4次業務會議"
108536, "「2024淡江大學行政單位數位轉型暨淨零轉型成果觀摩展」活動籌備會"
108535, "淡江大學工學院機械與機電工程學系113年度智慧機械產學推動計畫- 產業人才扎根分項計畫會議(3/14)"
108534, "淡江大學外國語文學院主管會議112學年度第2學期第2次會議"
108533, "淡江大學x弘祿x弘志能元 產學合作會議"
108532, "資工精準智慧創新跨領域研究社群_1130313"
108531, "減碳盤查團隊啟動會議"
108530, "淡江大學教務處112學年度第2學期第1次主管會議"
108529, "113學年度主軸四預算初審調整會議"
108528, "淡江大學水資源及環境工程學系112學年度第2學期學生校外實習委員會會議"
108527, "淡江大學學生事務處住宿輔導組112學年度第2學期第1次TQM會議"
108526, "微學分】AI實作體驗工作坊-「LINE-QA問答機器人」場次1"
108525, "微學分】AI實作體驗工作坊-「LINE-QA問答機器人」場次1"
108524, "淡江大學國際事務學院外交與國際關係學系系課程會議112學年度第2次會議"
108523, "淡江大學國際事務學院外交與國際關係學系系招生委員會113學年度第3次會議"
108522, "淡江大學國際事務學院外交與國際關係學院系招生委員會113學年度第3次會議"
108521, "淡江大學國際事務學院外交與國際關係學系112學年度第2學期第1次TQM會議"
108520, "資訊工程學系113學年度第1次系招生委員會"
108519, "淡江大學工學院機械系112學年度第2學期新聘專任教師面試"
108518, "從女力的角度試分析「武則天」的帝王業績"
108517, "淡江大學國際事務學院外交與國際關係學系系務會議112學年度第2學期第1次會議"
108506, "淡江大學體育事務處體育教學與活動組教師評審委員會113學年度第1次會議紀錄"
108505, "淡江大學體育事務處體育教學與活動組教師評審委員會113學年度第1次會議"
108504, "淡江大學理學院化學系112學年度第2次化學系獎學金委員會會議"
108503, "淡江大學112學年度第2學期第2次化學工程與材料工程學系 募款暨獎學金委員會會議"
108502, "統計學系112學年度第2學期第1次生物統計學程委員會議"
108501, "統計學系112學年度第2學期第2次工業統計學程委員會議"
108500, "統計學系112學年度第2學期第2次商業統計學程委員會議"
108499, "統計學系112學年度第2學期第2次系課程會議"
108498, "統計學系113學年度第1次教師評審委員會議陳閱單"
108497, "理學院112學年度第2學期導師會議"
108496, "統計學系113學年度第1次教師評審委員會議"
108495, "統計學系112學年度第2學期第2次系務會議"
108494, "2024淡江戰略學派年會_第一次籌備會"
108493, "淡江大學商管學院學位委員會BA小組112學年度第2學期第1次會議"
108492, "淡江大學工學院機械與機電工程學系112學年度第2學期第2次系獎學金會議"
108491, "淡江大學112學年度第2學期第1次資通安全暨個人資料管理審查會議"
108490, "iClass 學習平台教學應用與常見問題_第二梯"
108489, "iClass 學習平台教學應用與常見問題_第一梯"
108488, "淡江大學理學院物理學系獎學金委員會112學年度第3次會議"
108487, "淡江大學數學系112學年度第2次獎學金委員會會議"
108486, "淡江大學外國學生華語文教學發展小組112學年度第1次會議"
108485, "淡江大學外國語文學院日本語文學系112學年度第2學期第1次TQM會 議"
108484, "淡江大學數學系112學年度第2次獎學金委員會會議"
108483, "資訊工程學系112學年度第2學期第1次系課程委員會"
108482, "淡江大學學生事務處課外活動輔導組112學年度第2學期社團經費審查小組會議"
108481, "淡江大學重點研究補助審查小組112學年度第2次會議"
108480, "淡江大學資訊工程學系112學年度第2學期第1次系務會議"
108479, "淡江大學總務處事務整備組112學年度第2學期組務會議"
108478, "理學院尖端材料112學年度第2次課程委員會"
108477, "理學院尖端材料112學年度第2學期第1次事務會議"
108476, "淡江大學理學院化學學系113學年度第1次教師評審委員會-會議紀錄簽名單"
108475, "淡江大學資訊工程學系112學年度第5次TQM小組會議"
108474, "淡江大學理學院化學學系113學年度第1次教師評審委員會"
108473, "112學年度第2學期邦交國新生約談"
108472, "淡江大學教師跨領域研究社群：應用人工智慧技術達成書法自動布局系統"
108471, "淡江大學文學院112學年度第2學期第2次iLink計畫月會"
108470, "性別平等全英文講座"
108463, "新創討論會議"
108462, "工學院航空太空工程學系112學年度第2學期第2次課程委員會"
108461, "工學院航空太空工程學系112學年度第2學期第2次系務會議"
108460, "德國語文學系「求職講座」-外交之路(陳尚友副局長蒞校演講)"
108459, "淡江大學113學年度商管學院國際企業學系教師評審委員會第1次會議紀錄陳閱單"
108458, "淡江大學英文學系教師評審委員會113學年度第1次會議"
108457, "淡江大學113學年度商管學院國際企業學系教師評審委員會第1次會議"
108456, "淡江大學工學院土木工程學系112學年度第2學期第1次系課程委員會議"
108455, "淡江大學工學院土木工程學系112學年度第2學期第1次獎學金會議"
108454, "123"
108453, "淡江大學113學年度會計學系教師評審委員會第1次會議(陳閱單)"
108452, "淡江大學113學年度會計學系教師評審委員會第1次會議"
108451, "淡江大學113學年度商管學院企業管理學系教師評審委員會第1次會議"
108450, "淡江大學112學年度第2學期第1次零學分必修課程調整討論會"
108449, "淡江大學商管學院暨澳洲昆士蘭大學1+1雙聯學位說明會"
108448, "2023淡江大學永續報告書美編團隊徵招"
108447, "【資誠聯合會計師事務所】校園徵才說明會"
108446, "淡江大學商管學院「會計學系MBA」教學研究委員會112學年度第2次會議紀錄"
108445, "國際處週會(1130311)"
108444, "淡江大學商管學院「會計學系BS」教學研究委員會112學年度第2次會議紀錄"
108443, "淡江大學AI創智學院人工智慧學系112學年度第2學期第1次TQM會議簽到單"
108442, "淡江大學商管學院「會計學系EMBA」教學研究委員會112學年度第2次會議紀錄"
108441, "淡江大學工學院化學工程與材料工程學系 113 學年教師評審委員會第 1次會議【紀錄】"
108440, "淡江大學113學年度商管學院管理科學學系系教師評審委員會第3次會議陳閱單"
108439, "淡江大學113學年度商管學院管理科學學系系教師評審委員會第3次會議簽到單"
108438, "淡江大學工學院化學工程與材料工程學系 113 學年教師評審委員會第 1次會議【簽到】"
108437, "【星宇航空X淡江大學 首次校園講座】探索天際：飛航員職業生涯與發展"
108436, "淡江大學112學年度第13屆品管圈評審小組複審會議"
108426, "淡江大學國際事務學院國際事務與戰略研究所113學年度第1學期第1次所教師評審會議(會議呈閱單)"
108425, "淡江大學國際事務學院國際事務與戰略研究所113學年度第1學期第2次所教師評審會議"
108424, "淡江大學國際事務學院國際事務與戰略研究所112學年度第2學期第1次所課程會議"
108423, "淡江大學國際事務學院國際事務與戰略研究所112學年度第2學期第1次所務會議"
108422, "淡江大學外國語文學院西班牙語文學系系務會議112學年度第2學期第1次會議簽到單"
108421, "淡江大學外國語文學院西班牙語文學系招生委員會113學年度第2次會議簽到單"
108420, "淡江大學外國語文學院西班牙語文學系課程委員會112學年度第2學期第1次會議簽到單"
108419, "淡江大學人工智慧學系112學年度第2學期第1次系課程委員會議簽到單"
108418, "淡江大學人工智慧學系113學年度第3次系招生委員會議簽到單"
108417, "淡江大學人工智慧學系112學年度第2學期第1次系務會議簽到單"
108412, "圖書館112學年度第8次執行小組會議"
108411, "圖書館112學年度第7次執行小組會議"
108410, "圖書館112學年度第6次執行小組會議"
108409, "圖書館112學年度第5次執行小組會議"
108408, "2024 工學院與AI 創智學院 「系所探險趣」"
108407, "解析大學排名  透視高教競爭力 (《遠見雜誌》李建興總編輯)"
108406, "逐光-2024年淡江大學學系博覽會"
108405, "國家安全職涯高階講座—美國政治ABC：原來民主是這麼一回事？"
108404, "淡江大學體育事務處教師評審委員會113學年度第1次會議會議紀錄"
108403, "淡江大學體育事務處教師評審委員會113學年度第1次會議"
108389, "土木工程學系112學年度第2學期 第1次校外實習委員會議"
108388, "土木系112學年度淡江學教師跨領域研究社群會議—土木營建產業與AI的跨領域對話社群第4次會議"
108387, "土木系112學年度淡江學教師跨領域研究社群會議—土木營建產業與AI的跨領域對話社群第3次會議"
108386, "土木系112學年度第2學期第1次教師專業成長社群會議"
108385, "淡江大學商管學院募款管理委員會112學年度第7次會議紀錄"
108384, "112學年度資通安全管理制度內稽結果討論"
108383, "淡江大學教育品質管理委員會112學年度第3次會議"
108382, "財務資訊系統第 47 次工作協調會議"
108381, "旭正隆SBIR會議"
108380, "研究發展處產學推動例會(113年3-1)"
108379, "淡江大學大學社會責任實踐計畫辦公室113年度第1次室務會議"
108378, "淡江大學USR年報價值溝通暨成效評估實作工作坊"
108377, "微軟Microsoft 365 Copilot意見交流會"
108376, "淡江大學商管學院獎學金審查委員會112學年度第6次會議"
108375, "淡江大學商管學院獎學金審查委員會112學年度第5次會議"
108374, "112學年度第2學期第1次學術審議委員會"
108373, "淡江大學化學工程與材料工程學系112學年度第2學期第2次系務會議"
108372, "視障資源中心個案會議"
108371, "工學院機械與機電工程學系產業人才扎根分項計畫會議"
108365, "教育科技學系課程委員會112學年度第2學期第2次會議"
108364, "淡江大學113學年度商管學院運輸管理學系教師評審委員會第2次會議陳閱單"
108363, "淡江大學商管學院運輸管理學系112學年度第2學期第1次系務會議"
108362, "淡江大學商管學院運輸管理學系112學年度第3次募款委員會議簽到單"
108361, "淡江大學商管學院運輸管理學系112學年度第2學期第1次招生委員會議簽到單"
108360, "淡江大學商管學院運輸管理學系112學年度第2學期第1次課程委員會會議簽到單"
108359, "113學年度大學申請入學面試預約系統說明會"
108358, "遠距教學發展中心112學年度第2學期第1次中心業務會議"
108357, "會計學系112學年度第2學期第1次TQM會議"
108356, "俄文系職場講座:鄭如婷系友 題目: 找不到方向嗎？ 跨足不同領域，一起尋找職場快樂指南吧！"
108355, "淡江大學商管學院招生委員會113學年度第2次會議"
108354, "淡江大學國際事務學院全球政治經濟學系112學年度第2學期第1次TQM會議"
108353, "AI與程式語言112學年度第2學期第1次討論會"
108352, "淡江大學商管學院課程委員會112學年度第2學期第1次會議"
108351, "淡江大學商管學院112學年度第2學期第1次院務會議"
108350, "淡江大學化學工程與材料工程學系招生委員會113學年度第2次會議"
108348, "淡江大學113學年度商管學院運輸管理學系教師評審委員會第2次會議簽到單"
108347, "淡江大學商管學院資訊管理學系 教師評審委員會113學年度第1次會議紀錄 陳閱單"
108346, "淡江大學商管學院資訊管理學系 教師評審委員會113學年度第1次會議簽到單"
108345, "淡江大學113學年度商管學院管理科學學系系教師評審委員會第2次會議陳閱單"
108344, "淡江大學文學院資訊與圖書館學系112學年度第2學期第2次TQM會議紀錄"
108343, "淡江大學113學年度商管學院管理科學學系系教師評審委員會第2次會議簽到單"
108342, "淡江大學外國語文學院德國語文學系課程委員112學年度第2學期第1次會會議"
108341, "淡江大學外國語文學院德國語文學系務暨TQM112學年度第2學期第1次會議"
108340, "【賽博頻道 愛上淡江 學院系列報導】工學院拍攝"
108339, "淡江大學外國語文學院德國語文學系招生委員會113學年度第2次會議"
108326, "淡江大學外國語文學院日本語文學系系務會議112學年度第2學期第1次會議"
108325, "112學年度第2學期榮譽學程(B班)-3/21"
108324, "112學年度第2學期榮譽學程(A班)-3/11"
108323, "文學院112學年度第2學期第1次系主任座談會"
108322, "淡江大學工學院建築學系112學年度第2學期第1次系務會議"
108321, "淡江大學機械與機電工程學系 112學年度第2學期學生校外實習委員會第1次會議"
108320, "淡江大學工學院機械與機電工程學系113學年度招生委員會第3次會議"
108319, "淡江大學112學年度第2學期第1次化學工程與材料工程學系 募款暨獎學金委員會會議"
108318, "淡江大學機械與機電工程學系 112學年度第2學期第1次獎學金委員會會議"
108317, "淡江大學商管學院運輸管理學系112學年度第2學期第1次課程委員會會議"
108316, "淡江大學文學院中國文學學系學術委員會112學年度第2學期第1次會議"
108315, "淡江大學商管學院「運管系」教學研究委員會(MS)112學年度第2次會議紀錄"
108314, "淡江大學文學院中國文學學系招生委員會113學年度第2次會議"
108313, "淡江大學商管學院「運管系」教學研究委員會(BS)112學年度第2次會議紀錄"
108312, "學生獎助學金委員會112學年度第2學期會議"
108311, "有蓮獎學金校級審查委員會112學年度第6次會議"
108310, "淡江大學通識教育文學經典學門課程委員會112學年度第2次會議"
108309, "資訊處教學支援組113年3月TQM小組會議"
108308, "淡江大學商管學院學位委員會BBA小組112學年度第2學期 第1次會議"
108307, "113學年度身心障礙學生升學大專校院甄試北部（一）考區試務工作籌備會議"
108305, "有蓮獎學金校級審查委員會112學年度第5次會議"
108304, "淡江大學商管學院112學年度第2學期MA學位委員會"
108303, "淡江大學商管學院公共行政學系112學年度第2學期第1次TQM會議"
108302, "113年3月大學校院校務資料庫資料表冊填報及 院系所資料蒐集說明會"
108301, "淡江大學AI創智學院人工智慧學系112學年度第2學期第1次校外實習委員會議簽到單"
108300, "淡江大學文學院歷史學系112學年度第2學期第2次課程委員會議"
108299, "113學年度商管學院經濟學系教師評審委員會第1次會議陳閱單"
108298, "第13屆品管圈競賽-教務處註冊組文昌圈複審討論會議"
108289, "淡江大學商管學院運輸管理學系112學年度第2學期第1次TQM會議"
108288, "淡江大學113學年度財務金融學系教師評審委員會第3次會議"
108287, "淡江大學文學院資訊與圖書館學系112學年度第2學期第1次TQM會議"
108286, "AI與國際關係教師成長社群_AI時代下的美中霸權競逐"
108285, "淡江大學校務研究中心112學年度第2次業務會議"
108284, "校務研究中心112學年度第2學期第1次教師團隊會議"
108283, "淡江大學外國語文學院TQM小組會議112學年度第3次會議"
108282, "推廣教育處各中心TQM小組112學年度第2學期第1次會議紀錄"
108281, "低碳化企業永續經營 - 邁向淨零排放 x 智慧化科技發展趨勢與產業應用案例分享"
108280, "2024淡江大學行政單位數位轉型暨淨零轉型培訓成果觀摩"
108279, "淡江大學文學院資訊與圖書館學系募款委員會112學年度第2學期第1次會議"
108278, "淡江大學文學院資訊與圖書館學系系教師評審會議113學年度第2次會議(陳閱單)"
108277, "淡江大學文學院資訊與圖書館學系系教師評審會議113學年度第2次會議"
108276, "淡江大學文學院資訊與圖書館學系112學年度第2學期第1次系務會議"
108275, "2024淡江大學行政單位數位轉型暨淨零轉型成果觀摩展線上說明會"
108274, "淡江大學外國語文學院日本語文學系112學年度第2學期第1次課程委員會議紀錄"
108273, "113學年度商管學院經濟學系教師評審委員會第1次會議"
108272, "第195次行政會議"
108271, "2024淡江大學行政單位數位轉型暨淨零轉型培訓工作坊(場次一)"
108270, "淡江大學教育科技學系系務會議112學年度第2學期第2次會議"
108269, "生成式AI在教學上的應用4"
108268, "生成式AI在教學上的應用3"
108267, "Human x AI or Human vs. AI ?  我們與AI 一起合作的新工作模式"
108266, "生成式AI在教學上的應用2"
108265, "生成式AI在教學上的應用1"
108264, "AI人文跨域研究社群: AI化成品產出/活動歷程確認"
108263, "112學年度畢業典禮暨畢業生校園巡禮協調會議"
108262, "112學年度校務發展計畫產學主軸第2期追蹤管考會議"
108261, "AI人文跨域研究社群: 左宗棠雞/王致和腐乳"
108260, "淡江大學教育學院教師評審委員會113學年度第1次會議-會簽"
108259, "微軟亞洲教育部區域總經理 Larry Nelson 拜訪淡江大學"
108258, "AI人文跨域研究社群: 洪應明菜根/繼光餅"
108257, "國際處週會(1130304)"
108256, "淡江大學理學院112學年度第2學期第1次院務會議"
108255, "112-2 淡江大學視障資源中心資源教室 資訊與圖書館學系 ISP會議"
108254, "淡江大學112學年度第2學期英語能力檢定畢業門檻實施要點修訂會議"
108253, "112-2 淡江大學視障資源中心資源教室 中文系ISP會議"
108252, "112-2 淡江大學視障資源中心資源教室 歷史系 ISP會議"
108251, "國際觀光管理學系全英語學士班 113學年度第1次教師評審委員會會議"
108250, "國際觀光管理學系全英語學士班 113學年度第1次教師評審委員會會議(陳閱單)"
108249, "進學班遷於台北校園第1次工作會議"
108240, "淡江大學商管學院核心課程112學年度第2學期「企業倫理」教學委員會會議"
108239, "淡江大學商管學院核心課程112學年度第2學期「領導與團隊」教學委員會會議"
108238, "淡水校園福利部門廠商房屋稅及全校場地清潔費(營業稅)處理方案協調暨檢討會"
108237, "112學年度校務發展計畫主軸一第1次管考會議"
108236, "淡江大學教育學院112學年度第2學期第1次院務會議"
108235, "淡江大學教育學院課程委員會112學年度第2學期第1次會議"
108234, "淡江大學教育學院招生委員會113學年度第2次會議"
108233, "未來素養工作坊2"
108232, "未來素養工作坊1"
108231, "淡江大學教育學院教師評審委員會113學年度第1次會議-報到"
108230, "淡江大學教育學院112學年度第2學期第1次系所中心主管會議"
108229, "淡江大學教育學院募款委員會112學年度第2次會議"
108228, "淡江大學理學院招生委員會113學年度第2次會議"
108227, "淡江大學理學院課程委員會112學年度第2次會議"
108226, "人力資源處112學年度第5次處務會議"
108225, "淡江大學工學院電機工程學系112學年度第2學期第2次系務會議"
108224, "112學年度全校水上運動會籌備會議"
108223, "淡江大學國際事務與戰略研究所113學年度第1學期第1次教師評審會議"
108222, "國際觀光管理學系全英語學士班112學年度第2學期第1次系務會議"
108221, "國際觀光管理學系全英語學士班112學年度第2學期第1次課程委員會會議"
108220, "淡江大學國際事務學院募款管理委員會112學年度第2學期第1次會議"
108219, "淡江大學圖書館《蓋世無雙圈》112學年度第11次圈會"
108218, "企業管理學系112學年度第2學期第1次TQM會議"
108217, "EMBA 商管碩士在職專班112-2學期班務會議"
108216, "淡江大學113學年度商管學院運輸管理學系教師評審委員會第1次會議陳閱單"
108215, "淡江大學總務處 總務組113年3月TQM小組會議"
108214, "淡江大學113學年度商管學院運輸管理學系教師評審委員會第1次會議簽到單"
108213, "淡江大學112學年度商管學院運輸管理學系系主任遴選委員會會議紀錄 (113.2.29)陳閱單"
108212, "會計系碩士在職專班112學年度遴聘指導教授說明會"
108211, "淡江大學112學年度商管學院運輸管理學系系主任遴選委員會議簽到單"
108210, "112-2-2 資訊處主管工作會議"
108209, "淡江大學課程委員會112學年度第2學期會議"
108208, "淡江大學外國語文學門課程委員會議112學年度第2學期第1次會議"
108207, "教育科技學系招生專業化相關經驗分享講座"
108206, "文學院資傳系112學年度第2學期第1次課程委員會"
108205, "文學院資傳系113學年度第2次系招生委員會"
108204, "文學院資傳系112學年度第2學期第1次系務會議"
108203, "國家安全職涯高階講座-印度的地緣戰略及發展前景"
108202, "大眾傳播學系112學年度第2學期第1次系務會議"
108201, "淡江大學商管學院企業管理學系112學年度第2學期第1次系課程委員會議"
108200, "淡江大學商管學院企業管理學系113學年度第2次系招生委員會議"
108199, "淡江大學英文學系112學年度第2學期第1次課程委員會議"
108198, "淡江大學體育事務處體育教學與活動組112學年度第2學期第1次TQM會議"
108197, "SBIR產學合作會議"
108196, "112學年第2學期化學工程與材料工程學系第1次系務會議&TQM小組第1次會議"
108195, "淡江大學112學年第2學期通識教育課程 「資訊教育」學門第1次學門暨課程委員會會議"
108194, "淡江大學商管學院「經濟系」教學研究委員會112學年度第2次會議"
108193, "淡江大學工學院暨AI創智學院112學年度第2學期第1次主管會議"
108192, "淡江大學AI創智學院112學年度第2學期募款委員會會議"
108191, "淡江大學113學年度商管學院國際企業學系招生委員會第 3次會議簽到單"
108190, "國際企業學系112 學年度第2學期第1次課程委員會"
108189, "淡江大學工學院112學年度第2學期募款委員會會議"
108188, "工學院暨AI創智學院112學年度第2學期第1次主管會議"
108187, "乳沐春風 認識乳癌"
108186, "淡江大學112學年度數學系第2次電腦委員會會議"
108185, "淡江大學工學院電機工程學系招生委員會113學年度第3次會議"
108184, "資工系112學年度第2學期第1次系設備及空間規劃委員會會議"
108183, "法文系-淡江大學外語學院法文系112學年度第2學期第1次系務會議"
108182, "淡江大學文學院112學年度第2學期第1次智慧人文沙龍"
